Author,Quote,URL
Варрон,Труден лишь первый шаг. ,http://forismatic.com/ru/126a208096/
Габриэль Гарсия Маркес,Воплоти свои мечты. Это мгновение пришло.,http://forismatic.com/ru/61f9397ae3/
Габриель Гарсиа Маркес,"Возможно, в этом мире ты всего лишь человек, но для кого-то ты — весь мир. ",http://forismatic.com/ru/b51d006316/
Лев Толстой,"Когда мы узнаем новую мысль и признаем ее верною, нам кажется, что мы уже давно знали ее и теперь только вспомнили то, что знали. Всякая истина уже лежит в душе всякого человека. Только не заглушай ее ложью, и рано или поздно она откроется тебе.",http://forismatic.com/ru/d4d165ba1f/
Лев Толстой,"Во всех случаях, где употребляется насилие, прилагай разумное убеждение, и ты редко потеряешь в мирском смысле и всегда будешь в большом выигрыше в духовном.",http://forismatic.com/ru/36b55e8a92/
Лешек Кумор,Ложный шаг не раз приводил к открытию новых дорог. ,http://forismatic.com/ru/2826b6b6b8/
Руми,"Если хочешь построить новое, должен разрушить старое; если пшеница не обмолочена, как выпечь из неё хлеб?",http://forismatic.com/ru/7669c0603d/
Тайлер Дёрден,"Никакого страха. Никакого растрачивания себя впустую. Умение пустить то, что не слишком важно, на самотек. ",http://forismatic.com/ru/8f13dba2d7/
Фридрих Ницше,Победители не верят в случайность. ,http://forismatic.com/ru/5ddff46638/
